<?xml version="1.0" encoding="UTF-8" standalone="yes"?><!DOCTYPE report PUBLIC "-//JACOCO//DTD Report 1.1//EN" "report.dtd"><report name="demo"><sessioninfo id="TARKO-b69c633b" start="1685145576693" dump="1685145577227"/><sessioninfo id="TARKO-7743132d" start="1685145586376" dump="1685145586942"/><package name="com/searchelectriccharging"><class name="com/searchelectriccharging/MainApp" sourcefilename="MainApp.java"><method name="&lt;init&gt;" desc="()V" line="6"><counter type="INSTRUCTION" missed="3" covered="0"/><counter type="LINE" missed="1" covered="0"/><counter type="COMPLEXITY" missed="1" covered="0"/><counter type="METHOD" missed="1" covered="0"/></method><method name="main" desc="([Ljava/lang/String;)V" line="8"><counter type="INSTRUCTION" missed="6" covered="70"/><counter type="BRANCH" missed="2" covered="4"/><counter type="LINE" missed="2" covered="16"/><counter type="COMPLEXITY" missed="2" covered="2"/><counter type="METHOD" missed="0" covered="1"/></method><method name="createStations" desc="()Ljava/util/List;" line="36"><counter type="INSTRUCTION" missed="0" covered="30"/><counter type="LINE" missed="0" covered="6"/><counter type="COMPLEXITY" missed="0" covered="1"/><counter type="METHOD" missed="0" covered="1"/></method><counter type="INSTRUCTION" missed="9" covered="100"/><counter type="BRANCH" missed="2" covered="4"/><counter type="LINE" missed="3" covered="22"/><counter type="COMPLEXITY" missed="3" covered="3"/><counter type="METHOD" missed="1" covered="2"/><counter type="CLASS" missed="0" covered="1"/></class><class name="com/searchelectriccharging/Station" sourcefilename="MainApp.java"><method name="&lt;init&gt;" desc="(Ljava/lang/String;Ljava/lang/String;DI)V" line="53"><counter type="INSTRUCTION" missed="0" covered="22"/><counter type="LINE" missed="0" covered="8"/><counter type="COMPLEXITY" missed="0" covered="1"/><counter type="METHOD" missed="0" covered="1"/></method><method name="initializePortStatuses" desc="()V" line="63"><counter type="INSTRUCTION" missed="0" covered="14"/><counter type="BRANCH" missed="0" covered="2"/><counter type="LINE" missed="0" covered="3"/><counter type="COMPLEXITY" missed="0" covered="2"/><counter type="METHOD" missed="0" covered="1"/></method><method name="getName" desc="()Ljava/lang/String;" line="69"><counter type="INSTRUCTION" missed="0" covered="3"/><counter type="LINE" missed="0" covered="1"/><counter type="COMPLEXITY" missed="0" covered="1"/><counter type="METHOD" missed="0" covered="1"/></method><method name="getAddress" desc="()Ljava/lang/String;" line="73"><counter type="INSTRUCTION" missed="0" covered="3"/><counter type="LINE" missed="0" covered="1"/><counter type="COMPLEXITY" missed="0" covered="1"/><counter type="METHOD" missed="0" covered="1"/></method><method name="getChargeCost" desc="()D" line="77"><counter type="INSTRUCTION" missed="0" covered="3"/><counter type="LINE" missed="0" covered="1"/><counter type="COMPLEXITY" missed="0" covered="1"/><counter type="METHOD" missed="0" covered="1"/></method><method name="getNumPorts" desc="()I" line="81"><counter type="INSTRUCTION" missed="0" covered="3"/><counter type="LINE" missed="0" covered="1"/><counter type="COMPLEXITY" missed="0" covered="1"/><counter type="METHOD" missed="0" covered="1"/></method><method name="getPortStatuses" desc="()Ljava/util/List;" line="85"><counter type="INSTRUCTION" missed="0" covered="3"/><counter type="LINE" missed="0" covered="1"/><counter type="COMPLEXITY" missed="0" covered="1"/><counter type="METHOD" missed="0" covered="1"/></method><counter type="INSTRUCTION" missed="0" covered="51"/><counter type="BRANCH" missed="0" covered="2"/><counter type="LINE" missed="0" covered="16"/><counter type="COMPLEXITY" missed="0" covered="8"/><counter type="METHOD" missed="0" covered="7"/><counter type="CLASS" missed="0" covered="1"/></class><class name="com/searchelectriccharging/LanguageManager" sourcefilename="MainApp.java"><method name="&lt;init&gt;" desc="()V" line="138"><counter type="INSTRUCTION" missed="0" covered="3"/><counter type="LINE" missed="0" covered="1"/><counter type="COMPLEXITY" missed="0" covered="1"/><counter type="METHOD" missed="0" covered="1"/></method><method name="changeLanguage" desc="(Ljava/lang/String;)V" line="142"><counter type="INSTRUCTION" missed="0" covered="4"/><counter type="LINE" missed="0" covered="2"/><counter type="COMPLEXITY" missed="0" covered="1"/><counter type="METHOD" missed="0" covered="1"/></method><method name="getCurrentLanguage" desc="()Ljava/lang/String;" line="146"><counter type="INSTRUCTION" missed="0" covered="3"/><counter type="LINE" missed="0" covered="1"/><counter type="COMPLEXITY" missed="0" covered="1"/><counter type="METHOD" missed="0" covered="1"/></method><counter type="INSTRUCTION" missed="0" covered="10"/><counter type="LINE" missed="0" covered="4"/><counter type="COMPLEXITY" missed="0" covered="3"/><counter type="METHOD" missed="0" covered="3"/><counter type="CLASS" missed="0" covered="1"/></class><class name="com/searchelectriccharging/RoutePlanner" sourcefilename="MainApp.java"><method name="&lt;init&gt;" desc="(Ljava/util/List;)V" line="91"><counter type="INSTRUCTION" missed="0" covered="6"/><counter type="LINE" missed="0" covered="3"/><counter type="COMPLEXITY" missed="0" covered="1"/><counter type="METHOD" missed="0" covered="1"/></method><method name="findNearestStation" desc="()Lcom/searchelectriccharging/Station;" line="96"><counter type="INSTRUCTION" missed="0" covered="30"/><counter type="BRANCH" missed="0" covered="4"/><counter type="LINE" missed="0" covered="9"/><counter type="COMPLEXITY" missed="0" covered="3"/><counter type="METHOD" missed="0" covered="1"/></method><method name="calculateDistance" desc="(Lcom/searchelectriccharging/Station;)D" line="109"><counter type="INSTRUCTION" missed="0" covered="23"/><counter type="LINE" missed="0" covered="6"/><counter type="COMPLEXITY" missed="0" covered="1"/><counter type="METHOD" missed="0" covered="1"/></method><method name="getAvailableStations" desc="()Ljava/util/List;" line="118"><counter type="INSTRUCTION" missed="0" covered="26"/><counter type="BRANCH" missed="1" covered="3"/><counter type="LINE" missed="0" covered="6"/><counter type="COMPLEXITY" missed="1" covered="2"/><counter type="METHOD" missed="0" covered="1"/></method><method name="isStationAvailable" desc="(Lcom/searchelectriccharging/Station;)Z" line="129"><counter type="INSTRUCTION" missed="3" covered="19"/><counter type="BRANCH" missed="2" covered="2"/><counter type="LINE" missed="2" covered="4"/><counter type="COMPLEXITY" missed="2" covered="1"/><counter type="METHOD" missed="0" covered="1"/></method><counter type="INSTRUCTION" missed="3" covered="104"/><counter type="BRANCH" missed="3" covered="9"/><counter type="LINE" missed="2" covered="28"/><counter type="COMPLEXITY" missed="3" covered="8"/><counter type="METHOD" missed="0" covered="5"/><counter type="CLASS" missed="0" covered="1"/></class><sourcefile name="MainApp.java"><line nr="6" mi="3" ci="0" mb="0" cb="0"/><line nr="8" mi="0" ci="2" mb="0" cb="0"/><line nr="10" mi="0" ci="5" mb="0" cb="0"/><line nr="12" mi="0" ci="3" mb="0" cb="0"/><line nr="13" mi="0" ci="2" mb="1" cb="1"/><line nr="14" mi="0" ci="12" mb="0" cb="0"/><line nr="16" mi="3" ci="0" mb="0" cb="0"/><line nr="19" mi="0" ci="3" mb="0" cb="0"/><line nr="20" mi="0" ci="3" mb="1" cb="1"/><line nr="21" mi="0" ci="3" mb="0" cb="0"/><line nr="22" mi="0" ci="10" mb="0" cb="2"/><line nr="23" mi="0" ci="4" mb="0" cb="0"/><line nr="24" mi="0" ci="2" mb="0" cb="0"/><line nr="26" mi="3" ci="0" mb="0" cb="0"/><line nr="29" mi="0" ci="4" mb="0" cb="0"/><line nr="30" mi="0" ci="3" mb="0" cb="0"/><line nr="31" mi="0" ci="3" mb="0" cb="0"/><line nr="32" mi="0" ci="10" mb="0" cb="0"/><line nr="33" mi="0" ci="1" mb="0" cb="0"/><line nr="36" mi="0" ci="8" mb="0" cb="0"/><line nr="37" mi="0" ci="8" mb="0" cb="0"/><line nr="39" mi="0" ci="4" mb="0" cb="0"/><line nr="40" mi="0" ci="4" mb="0" cb="0"/><line nr="41" mi="0" ci="4" mb="0" cb="0"/><line nr="43" mi="0" ci="2" mb="0" cb="0"/><line nr="53" mi="0" ci="2" mb="0" cb="0"/><line nr="54" mi="0" ci="3" mb="0" cb="0"/><line nr="55" mi="0" ci="3" mb="0" cb="0"/><line nr="56" mi="0" ci="3" mb="0" cb="0"/><line nr="57" mi="0" ci="3" mb="0" cb="0"/><line nr="58" mi="0" ci="5" mb="0" cb="0"/><line nr="59" mi="0" ci="2" mb="0" cb="0"/><line nr="60" mi="0" ci="1" mb="0" cb="0"/><line nr="63" mi="0" ci="8" mb="0" cb="2"/><line nr="64" mi="0" ci="5" mb="0" cb="0"/><line nr="66" mi="0" ci="1" mb="0" cb="0"/><line nr="69" mi="0" ci="3" mb="0" cb="0"/><line nr="73" mi="0" ci="3" mb="0" cb="0"/><line nr="77" mi="0" ci="3" mb="0" cb="0"/><line nr="81" mi="0" ci="3" mb="0" cb="0"/><line nr="85" mi="0" ci="3" mb="0" cb="0"/><line nr="91" mi="0" ci="2" mb="0" cb="0"/><line nr="92" mi="0" ci="3" mb="0" cb="0"/><line nr="93" mi="0" ci="1" mb="0" cb="0"/><line nr="96" mi="0" ci="2" mb="0" cb="0"/><line nr="97" mi="0" ci="2" mb="0" cb="0"/><line nr="98" mi="0" ci="11" mb="0" cb="2"/><line nr="99" mi="0" ci="4" mb="0" cb="0"/><line nr="100" mi="0" ci="4" mb="0" cb="2"/><line nr="101" mi="0" ci="2" mb="0" cb="0"/><line nr="102" mi="0" ci="2" mb="0" cb="0"/><line nr="104" mi="0" ci="1" mb="0" cb="0"/><line nr="105" mi="0" ci="2" mb="0" cb="0"/><line nr="109" mi="0" ci="2" mb="0" cb="0"/><line nr="110" mi="0" ci="2" mb="0" cb="0"/><line nr="111" mi="0" ci="2" mb="0" cb="0"/><line nr="112" mi="0" ci="2" mb="0" cb="0"/><line nr="113" mi="0" ci="13" mb="0" cb="0"/><line nr="114" mi="0" ci="2" mb="0" cb="0"/><line nr="118" mi="0" ci="4" mb="0" cb="0"/><line nr="120" mi="0" ci="11" mb="0" cb="2"/><line nr="121" mi="0" ci="4" mb="1" cb="1"/><line nr="122" mi="0" ci="4" mb="0" cb="0"/><line nr="124" mi="0" ci="1" mb="0" cb="0"/><line nr="125" mi="0" ci="2" mb="0" cb="0"/><line nr="129" mi="0" ci="3" mb="0" cb="0"/><line nr="130" mi="0" ci="10" mb="1" cb="1"/><line nr="131" mi="0" ci="4" mb="1" cb="1"/><line nr="132" mi="0" ci="2" mb="0" cb="0"/><line nr="134" mi="1" ci="0" m